PMID,OWN,STAT,DCOM,LR,IS,VI,IP,DP,TI,PG,FAU,AU,LA,PT,TT,PL,TA,JT,JID,RN,SB,MH,OID,OTO,OT,EDAT,MHDA,CRDT,PHST,PST,SO,AID,PMC,AB,AD,DEP,RF,GR
13208850,NLM,MEDLINE,20030501,20181201,0539-6115 (Print) 0539-6115 (Linking),11,4,1954 Aug 1,[Three reticuloendothelial syndromes].,389-401,"['SILVA AGUILAR, M']",['SILVA AGUILAR M'],['spa'],['Journal Article'],Tres sandromes de reticuloendoteliosis.,Mexico,Bol Med Hosp Infant Mex,Boletin medico del Hospital Infantil de Mexico,0414106,"['Reticuloendotheliosis, X-linked']",OM,"['Eosinophilic Granuloma/*physiology', '*Genetic Diseases, X-Linked', '*Leukemia, Hairy Cell', '*Lymphatic Diseases', '*Severe Combined Immunodeficiency', '*Syndrome']",['CLML: 5527:20626:162:403'],['NLM'],"['*EOSINOPHILIC GRANULOMA/physiology', '*RETICULOENDOTHELIOSIS']",1954/08/01 00:00,1954/08/01 00:01,['1954/08/01 00:00'],"['1954/08/01 00:00 [pubmed]', '1954/08/01 00:01 [medline]', '1954/08/01 00:00 [entrez]']",ppublish,Bol Med Hosp Infant Mex. 1954 Aug 1;11(4):389-401.,,,,,,,
13208759,NLM,MEDLINE,20030501,20210216,0006-4971 (Print) 0006-4971 (Linking),9,11,1954 Nov,Incorporation of radioactive L-cystine by normal and leukemic leukocytes in vivo.,1082-94,"['WEISBERGER, A S', 'LEVINE, B']","['WEISBERGER AS', 'LEVINE B']",['eng'],['Journal Article'],,United States,Blood,Blood,7603509,['48TCX9A1VT (Cystine)'],OM,"['Cystine/*blood', 'Humans', 'Leukemia/*blood', '*Leukocytes']",['CLML: 5527:20535:130:262'],['NLM'],"['*CYSTINE/in blood', '*LEUKEMIA/blood in']",1954/11/01 00:00,1954/11/01 00:01,['1954/11/01 00:00'],"['1954/11/01 00:00 [pubmed]', '1954/11/01 00:01 [medline]', '1954/11/01 00:00 [entrez]']",ppublish,Blood. 1954 Nov;9(11):1082-94.,['S0006-4971(20)75620-X [pii]'],,,,,,
13208545,NLM,MEDLINE,20030501,20181201,0366-368X (Print),10,18,1954 Sep 15,[An unusual eruption in lymphatic leukemia].,872-4,"['VERSTRAETEN, J']",['VERSTRAETEN J'],['dut'],['Journal Article'],Een eigenaardige huiduitslag (lymphoide leucaemie).,Belgium,Belg Tijdschr Geneesk,Belgisch tijdschrift voor geneeskunde,15510370R,,OM,"['*Exanthema', 'Humans', '*Leukemia', '*Leukemia, Lymphoid', '*Skin']",['CLML: 5527:20321:263:422'],['NLM'],"['*LEUKEMIA, LYMPHATIC/manifestations', '*SKIN']",1954/09/15 00:00,1954/09/15 00:01,['1954/09/15 00:00'],"['1954/09/15 00:00 [pubmed]', '1954/09/15 00:01 [medline]', '1954/09/15 00:00 [entrez]']",ppublish,Belg Tijdschr Geneesk. 1954 Sep 15;10(18):872-4.,,,,,,,
13208520,NLM,MEDLINE,20030501,20181201,0524-1162 (Print) 0524-1162 (Linking),5,3,1954 Sep,The folic acid antagonists and their use in the treatment of acute leukemia.,91-2,"['BOYD, G K']",['BOYD GK'],['eng'],['Journal Article'],,United States,BMQ,BMQ; the Boston medical quarterly,0120774,['0 (Folic Acid Antagonists)'],OM,"['*Acute Disease', 'Folic Acid Antagonists/*therapeutic use', 'Leukemia/*therapy']",['CLML: 5527:20296:184:262'],['NLM'],"['*FOLIC ACID ANTAGONISTS/therapeutic use', '*LEUKEMIA/therapy']",1954/09/01 00:00,1954/09/01 00:01,['1954/09/01 00:00'],"['1954/09/01 00:00 [pubmed]', '1954/09/01 00:01 [medline]', '1954/09/01 00:00 [entrez]']",ppublish,BMQ. 1954 Sep;5(3):91-2.,,,,,,,
13208358,NLM,MEDLINE,20030501,20181201,0003-9691 (Print) 0003-9691 (Linking),15,5,1954,[A case of acute leukemia in a person inhaling higher benzene homologs].,399-401,"['TOLOT, F']",['TOLOT F'],['fre'],['Journal Article'],Une observation de leucose aigue chez un sujet inhalant des homologues superieurs du benzene (etiquette verte).,France,Arch Mal Prof,Archives des maladies professionnelles de medecine du travail et de securite sociale,2985157R,['J64922108F (Benzene)'],OM,"['*Acute Disease', 'Benzene/*poisoning', 'Humans', 'Leukemia/*etiology', '*Poisoning']",['CLML: 5527:20134:60:262:366'],['NLM'],"['*BENZENE/poisoning', '*LEUKEMIA/etiology and pathogenesis', '*POISONING']",1954/01/01 00:00,1954/01/01 00:01,['1954/01/01 00:00'],"['1954/01/01 00:00 [pubmed]', '1954/01/01 00:01 [medline]', '1954/01/01 00:00 [entrez]']",ppublish,Arch Mal Prof. 1954;15(5):399-401.,,,,,,,
13208051,NLM,MEDLINE,20030501,20190619,0003-4819 (Print) 0003-4819 (Linking),41,5,1954 Nov,Transmissibility of leukemia.,1084-8,"['CLOUGH, P W']",['CLOUGH PW'],['eng'],['Journal Article'],,United States,Ann Intern Med,Annals of internal medicine,0372351,,OM,"['Animals', '*Leukemia', '*Leukemia, Experimental']",['CLML: 5527:19820:262'],['NLM'],['*LEUKEMIA/experimental'],1954/11/01 00:00,1954/11/01 00:01,['1954/11/01 00:00'],"['1954/11/01 00:00 [pubmed]', '1954/11/01 00:01 [medline]', '1954/11/01 00:00 [entrez]']",ppublish,Ann Intern Med. 1954 Nov;41(5):1084-8. doi: 10.7326/0003-4819-41-5-1084.,['10.7326/0003-4819-41-5-1084 [doi]'],,,,,,
13206994,NLM,MEDLINE,20030501,20181201,,58,8,1954 Aug,[Subacute lymphoid leukemia and pulmonary miliaria].,627-9,"['BENHAMOU, E', 'ALBOU, A', 'AMOUYAL, J']","['BENHAMOU E', 'ALBOU A', 'AMOUYAL J']",['fre'],['Journal Article'],Leucemie lymphoide subaigue et miliaire pulmonaire.,Algeria,Alger Medicale,Algerie medicale,14720550R,,OM,"['Humans', '*Leukemia', 'Leukemia, Lymphoid/*complications', '*Lymphatic Vessels', '*Tuberculosis', 'Tuberculosis, Miliary/*complications']",['CLML: 5527:18733:263:471'],['NLM'],"['*LEUKEMIA, LYMPHATIC/complications', '*TUBERCULOSIS, MILIARY/complications']",1954/08/01 00:00,1954/08/01 00:01,['1954/08/01 00:00'],"['1954/08/01 00:00 [pubmed]', '1954/08/01 00:01 [medline]', '1954/08/01 00:00 [entrez]']",ppublish,Alger Medicale. 1954 Aug;58(8):627-9.,,,,,,,
13206990,NLM,MEDLINE,20030501,20181201,,58,8,1954 Aug,[Chronic myeloid leukemia in children; 2 case reports].,603-13,"['PORTIER, A', 'MASSONNAT, J', 'CABANNES, R', 'DEYME, H', 'NAKACHE, P']","['PORTIER A', 'MASSONNAT J', 'CABANNES R', 'DEYME H', 'NAKACHE P']",['fre'],['Journal Article'],La leucemie myeloide chronique de l'enfant; a propos de deux observations.,Algeria,Alger Medicale,Algerie medicale,14720550R,,OM,"['Child', 'Humans', 'Infant', '*Leukemia', '*Leukemia, Myelogenous, Chronic, BCR-ABL Positive', '*Leukemia, Myeloid']",['CLML: 5527:18729:263'],['NLM'],"['*LEUKEMIA, MYELOCYTIC/in infant and child']",1954/08/01 00:00,1954/08/01 00:01,['1954/08/01 00:00'],"['1954/08/01 00:00 [pubmed]', '1954/08/01 00:01 [medline]', '1954/08/01 00:00 [entrez]']",ppublish,Alger Medicale. 1954 Aug;58(8):603-13.,,,,,,,
13206864,NLM,MEDLINE,20030501,20181201,0001-7310 (Print) 0001-7310 (Linking),45,8,1954 May,[A case of lymphoid leukemia].,675-7,"['QUINONES, P A', 'FUENTES, T']","['QUINONES PA', 'FUENTES T']",['spa'],['Journal Article'],Un caso de leucemia linfoide.,Spain,Actas Dermosifiliogr,Actas dermo-sifiliograficas,0373062,,OM,"['Humans', '*Leukemia', '*Leukemia, Lymphoid']",['CLML: 5527:18603:262'],['NLM'],"['*LEUKEMIA, LYMPHATIC']",1954/05/01 00:00,1954/05/01 00:01,['1954/05/01 00:00'],"['1954/05/01 00:00 [pubmed]', '1954/05/01 00:01 [medline]', '1954/05/01 00:00 [entrez]']",ppublish,Actas Dermosifiliogr. 1954 May;45(8):675-7.,,,,,,,
13206393,NLM,MEDLINE,20030501,20191107,2374-2941 (Print) 2374-2941 (Linking),88,6,1954 Dec,Cystic changes of the lungs in histiocytosis.,764-71,"['KEATS, T E', 'CRANE, J F']","['KEATS TE', 'CRANE JF']",['eng'],['Journal Article'],,United States,AMA Am J Dis Child,A.M.A. American journal of diseases of children,14470010R,"['Reticuloendotheliosis, X-linked']",OM,"['*Cysts', '*Genetic Diseases, X-Linked', '*Histiocytosis', 'Humans', '*Leukemia, Hairy Cell', '*Lung', '*Lung Diseases', '*Lymphatic Diseases', '*Severe Combined Immunodeficiency']",['CLML: 5527:18132:130:272:402'],['NLM'],"['*CYSTS', '*LUNGS/cysts', '*RETICULOENDOTHELIOSIS']",1954/12/01 00:00,1954/12/01 00:01,['1954/12/01 00:00'],"['1954/12/01 00:00 [pubmed]', '1954/12/01 00:01 [medline]', '1954/12/01 00:00 [entrez]']",ppublish,AMA Am J Dis Child. 1954 Dec;88(6):764-71. doi: 10.1001/archpedi.1954.02050100766010.,['10.1001/archpedi.1954.02050100766010 [doi]'],,,,,,
13206388,NLM,MEDLINE,20030501,20191107,2374-2941 (Print) 2374-2941 (Linking),88,6,1954 Dec,Congenital leukemia.,740-2,"[""O'CONNOR, R E"", 'McKEY, R W', 'SMITH, J']","[""O'CONNOR RE"", 'McKEY RW', 'SMITH J']",['eng'],['Journal Article'],,United States,AMA Am J Dis Child,A.M.A. American journal of diseases of children,14470010R,,OM,"['*Bacteremia', 'Child', 'Humans', 'Infant', 'Infant, Newborn', '*Infant, Newborn, Diseases', '*Leukemia', '*Sepsis']",['CLML: 5527:18127:236:262:416'],['NLM'],"['*INFANT, NEWBORN/diseases', '*LEUKEMIA/in infant and child', '*SEPTICEMIA AND BACTEREMIA/in infant and child']",1954/12/01 00:00,1954/12/01 00:01,['1954/12/01 00:00'],"['1954/12/01 00:00 [pubmed]', '1954/12/01 00:01 [medline]', '1954/12/01 00:00 [entrez]']",ppublish,AMA Am J Dis Child. 1954 Dec;88(6):740-2. doi: 10.1001/archpedi.1954.02050100742005.,['10.1001/archpedi.1954.02050100742005 [doi]'],,,,,,
13206271,NLM,MEDLINE,20030501,20181201,0863-0267 (Print) 0863-0267 (Linking),47,7,1954,[Case of lymphatic-leukemic infiltration of testes and epididymis].,423-6,"['GUMPESBERGER, G', 'ZIMMER, W']","['GUMPESBERGER G', 'ZIMMER W']",['ger'],['Journal Article'],Ein Fall von lymphatisch-leukamischen Infiltrat in Hoden und Nebenhoden.,Germany,Z Urol,Zeitschrift fur Urologie,21810140R,,OM,"['*Abscess', '*Epididymis', 'Humans', '*Leukemia', 'Leukemia, Lymphoid/*complications', '*Leukemic Infiltration', '*Lymphatic Vessels', 'Male', '*Testicular Diseases', '*Testis']",['CLML: 5527:17967:5:162:262:451'],['NLM'],"['*ABSCESS', '*EPIDIDYMIS/abscess', '*LEUKEMIA, LYMPHATIC/complications', '*TESTES/abscess']",1954/01/01 00:00,1954/01/01 00:01,['1954/01/01 00:00'],"['1954/01/01 00:00 [pubmed]', '1954/01/01 00:01 [medline]', '1954/01/01 00:00 [entrez]']",ppublish,Z Urol. 1954;47(7):423-6.,,,,,,,
13206156,NLM,MEDLINE,20030501,20181201,0044-2542 (Print) 0044-2542 (Linking),9,12,1954 Jun 15,[The appearance of mitosis in the circulating blood during treatment of myeloid leukemia with triethylene melamine].,616-8,"['BRUGSCH, J', 'TICHTER, E']","['BRUGSCH J', 'TICHTER E']",['ger'],['Journal Article'],Uber das Auftreten von Mitosen im stromenden Blut bei der Behandlung myeloischer Leukamien mit Triathylenmelamin.,Germany,Z Gesamte Inn Med,Zeitschrift fur die gesamte innere Medizin und ihre Grenzgebiete,21730470R,['F7IY6HZG9D (Triethylenemelamine)'],OM,"['Blood Cells/*drug effects', '*Cell Division', '*Leukemia', 'Leukemia, Myeloid/*therapy', '*Mitosis', 'Triethylenemelamine/*therapeutic use']",['CLML: 5527:17847:71:100:263:466'],['NLM'],"['*BLOOD CELLS/effect of drugs on', '*CELL DIVISION', '*LEUKEMIA, MYELOCYTIC/therapy', '*TRIETHYLENE MELAMINE/therapeutic use']",1954/06/15 00:00,1954/06/15 00:01,['1954/06/15 00:00'],"['1954/06/15 00:00 [pubmed]', '1954/06/15 00:01 [medline]', '1954/06/15 00:00 [entrez]']",ppublish,Z Gesamte Inn Med. 1954 Jun 15;9(12):616-8.,,,,,,,
13204785,NLM,MEDLINE,20030501,20181201,0034-9445 (Print) 0034-9445 (Linking),13,75,1954 May-Jun,[Genital lesions in acute leukemia].,148-52,"['MUNOZ FERRER, F', 'PASTOR PEREZ, F']","['MUNOZ FERRER F', 'PASTOR PEREZ F']",['spa'],['Journal Article'],Lesiones genitales en la leucemia aguda.,Spain,Rev Esp Obstet Ginecol,Revista espanola de obstetricia y ginecologia,0270525,,OM,"['*Acute Disease', 'Female', 'Genital Diseases, Female/*complications', '*Gynecology', 'Humans', 'Leukemia/*complications']",['CLML: 5527:16455:202:262'],['NLM'],"['*GYNECOLOGICAL DISEASES/complications', '*LEUKEMIA/complications']",1954/05/01 00:00,1954/05/01 00:01,['1954/05/01 00:00'],"['1954/05/01 00:00 [pubmed]', '1954/05/01 00:01 [medline]', '1954/05/01 00:00 [entrez]']",ppublish,Rev Esp Obstet Ginecol. 1954 May-Jun;13(75):148-52.,,,,,,,
13204443,NLM,MEDLINE,20030501,20181201,0370-1514 (Print) 0370-1514 (Linking),10,13,1954 Jul 15,[Chronic splenomegalic lymphatic disease (Brill-Symmer's disease?) terminating in acute polyphasic leukemia].,391-8,"['GERMINI, P', 'DOTTA, F']","['GERMINI P', 'DOTTA F']",['ita'],['Journal Article'],Su di un caso di linfopatia cronica splenomegalic (morbo di Brill-Symmers?) terminante in leucemia acuta a decorso polifasico.,Italy,Prog Med (Napoli),Il Progresso medico,2984827R,,OM,"['Humans', '*Leukemia', '*Leukemia, Lymphoid', '*Lymphatic Diseases', '*Lymphoma', '*Lymphoma, Non-Hodgkin']",['CLML: 5527:16113:262:277'],['NLM'],"['*LEUKEMIA, LYMPHATIC', '*LYMPHOSARCOMA']",1954/07/15 00:00,1954/07/15 00:01,['1954/07/15 00:00'],"['1954/07/15 00:00 [pubmed]', '1954/07/15 00:01 [medline]', '1954/07/15 00:00 [entrez]']",ppublish,Prog Med (Napoli). 1954 Jul 15;10(13):391-8.,,,,,,,
13204387,NLM,MEDLINE,20030501,20200930,0037-9727 (Print) 0037-9727 (Linking),86,4,1954 Aug-Sep,Leukemia. VI. Effect of amicetin on transplanted mouse leukemia.,891-3,"['BURCHENAL, J H', 'YUCEOGLU, M', 'DAGG, M K', 'STOCK, C C']","['BURCHENAL JH', 'YUCEOGLU M', 'DAGG MK', 'STOCK CC']",['eng'],['Journal Article'],,United States,Proc Soc Exp Biol Med,"Proceedings of the Society for Experimental Biology and Medicine. Society for Experimental Biology and Medicine (New York, N.Y.)",7505892,"['0 (Anti-Bacterial Agents)', '0 (Antibiotics, Antitubercular)', '0 (Pyrimidine Nucleosides)', '0909X15C85 (amicetin)']",OM,"['Animals', 'Anti-Bacterial Agents/*pharmacology', '*Antibiotics, Antitubercular', '*Leukemia', '*Leukemia, Experimental', '*Pyrimidine Nucleosides']",['CLML: 5527:16057:35:262'],['NLM'],"['*ANTIBIOTICS/effects', '*LEUKEMIA/experimental']",1954/08/01 00:00,1954/08/01 00:01,['1954/08/01 00:00'],"['1954/08/01 00:00 [pubmed]', '1954/08/01 00:01 [medline]', '1954/08/01 00:00 [entrez]']",ppublish,Proc Soc Exp Biol Med. 1954 Aug-Sep;86(4):891-3. doi: 10.3181/00379727-86-21265.,['10.3181/00379727-86-21265 [doi]'],,,,,,
13204348,NLM,MEDLINE,20030501,20200930,0037-9727 (Print) 0037-9727 (Linking),86,4,1954 Aug-Sep,Thromboplastic activity of leukemic white cells.,763-5,"['EISEMAN, G', 'STEFANINI, M']","['EISEMAN G', 'STEFANINI M']",['eng'],['Journal Article'],,United States,Proc Soc Exp Biol Med,"Proceedings of the Society for Experimental Biology and Medicine. Society for Experimental Biology and Medicine (New York, N.Y.)",7505892,['9035-58-9 (Thromboplastin)'],OM,"['Humans', 'Leukemia/*blood', '*Leukocytes', '*Thromboplastin']",['CLML: 5527:16018:262:263:456'],['NLM'],"['*LEUKEMIA/blood in', '*LEUKOCYTES', '*THROMBOPLASTIC SUBSTANCES']",1954/08/01 00:00,1954/08/01 00:01,['1954/08/01 00:00'],"['1954/08/01 00:00 [pubmed]', '1954/08/01 00:01 [medline]', '1954/08/01 00:00 [entrez]']",ppublish,Proc Soc Exp Biol Med. 1954 Aug-Sep;86(4):763-5. doi: 10.3181/00379727-86-21226.,['10.3181/00379727-86-21226 [doi]'],,,,,,
13204339,NLM,MEDLINE,20030501,20200930,0037-9727 (Print) 0037-9727 (Linking),86,4,1954 Aug-Sep,Transmission of Ak leukemic agent into newborn mice of the C57 brown/cd inbred line.,734-9,"['GROSS, L']",['GROSS L'],['eng'],['Journal Article'],,United States,Proc Soc Exp Biol Med,"Proceedings of the Society for Experimental Biology and Medicine. Society for Experimental Biology and Medicine (New York, N.Y.)",7505892,,OM,"['Animals', '*Animals, Laboratory', '*Leukemia, Experimental', 'Mice']",['CLML: 5527:16009:262'],['NLM'],['*LEUKEMIA/experimental'],1954/08/01 00:00,1954/08/01 00:01,['1954/08/01 00:00'],"['1954/08/01 00:00 [pubmed]', '1954/08/01 00:01 [medline]', '1954/08/01 00:00 [entrez]']",ppublish,Proc Soc Exp Biol Med. 1954 Aug-Sep;86(4):734-9. doi: 10.3181/00379727-86-21217.,['10.3181/00379727-86-21217 [doi]'],,,,,,
13204120,NLM,MEDLINE,20030501,20181201,0031-4021 (Print) 0031-4021 (Linking),9,5,1954,[Plasmocytic cryptoleukosis with leukoblastic tumors of the jaws].,511-4,"['JEUNE, M', 'MOREL, P', 'BETHENOD, M', 'BADON, A']","['JEUNE M', 'MOREL P', 'BETHENOD M', 'BADON A']",['fre'],['Journal Article'],Cryptoleucose plasmocytaire avec tumeurs maxillaires leucoblastiques.,France,Pediatrie,Pediatrie,0401127,,OM,"['Child', 'Humans', 'Infant', '*Jaw', '*Jaw Neoplasms', '*Leukemia', '*Neoplasms']",['CLML: 5527:15780:248:262'],['NLM'],"['*JAWS/neoplasms', '*LEUKEMIA/in infant and child']",1954/01/01 00:00,1954/01/01 00:01,['1954/01/01 00:00'],"['1954/01/01 00:00 [pubmed]', '1954/01/01 00:01 [medline]', '1954/01/01 00:00 [entrez]']",ppublish,Pediatrie. 1954;9(5):511-4.,,,,,,,
13204119,NLM,MEDLINE,20030501,20181201,0031-4021 (Print) 0031-4021 (Linking),9,5,1954,"[Acute leukemia treated with ACTH and cortisone: temporary remission, development of tumoral splenomegaly, relapse and death].",509-11,"['MONNET, P', 'GILLY, R', 'BERTRAND, J']","['MONNET P', 'GILLY R', 'BERTRAND J']",['fre'],['Journal Article'],"Leucose aigue traitee par A.C.T.H. et cortisone: remission passagere, constitution d'une splenomegalie tumorale, rechute, deces.",France,Pediatrie,Pediatrie,0401127,"['9002-60-2 (Adrenocorticotropic Hormone)', 'V27W9254FZ (Cortisone)']",OM,"['*Acute Disease', 'Adrenocorticotropic Hormone/*therapeutic use', 'Child', 'Cortisone/*therapeutic use', '*Death', 'Humans', 'Infant', '*Leukemia', '*Neoplasms', '*Recurrence', '*Splenomegaly']",['CLML: 5527:15779:10:125:262'],['NLM'],"['*ACTH/therapeutic use', '*CORTISONE/therapeutic use', '*LEUKEMIA/in infant and child']",1954/01/01 00:00,1954/01/01 00:01,['1954/01/01 00:00'],"['1954/01/01 00:00 [pubmed]', '1954/01/01 00:01 [medline]', '1954/01/01 00:00 [entrez]']",ppublish,Pediatrie. 1954;9(5):509-11.,,,,,,,
13202510,NLM,MEDLINE,20030501,20181201,,9,15-16,1954 Aug 1,[Quantitative studies on the effect of pterin on the leukocytes].,348-52,"['BILEK, O']",['BILEK O'],['cze'],['Journal Article'],Kvantitativna pusobena pterinu na baly krevna obraz.,Czech Republic,Lek List,Lekarske listy,18310680R,['0 (Pterins)'],OM,"['Animals', '*Leukemia, Experimental', 'Leukocytes/*drug effects', 'Pterins/*pharmacology']",['CLML: 5527:14162:262:263:387'],['NLM'],"['*LEUKEMIA/experimental', '*LEUKOCYTES/effect of drugs on', '*PTERINS/effects']",1954/08/01 00:00,1954/08/01 00:01,['1954/08/01 00:00'],"['1954/08/01 00:00 [pubmed]', '1954/08/01 00:01 [medline]', '1954/08/01 00:00 [entrez]']",ppublish,Lek List. 1954 Aug 1;9(15-16):348-52.,,,,,,,
13202446,NLM,MEDLINE,20030501,20181201,0368-6698 (Print) 0368-6698 (Linking),9,4,1954 Aug,[Case of acute myelosis with excessive reticular (monocytoid) reaction; contribution on the problem of monocytic leukemia].,230-3,"['WAGNER, K']",['WAGNER K'],['ger'],['Journal Article'],Ein Fall einer akuten Myelose mit exzessiver retikularer (monozytoider) Reaktion; zum Problem der Monozytenleukamien.,Austria,Krebsarzt,Der Krebsarzt,0251004,,OM,"['*Bone Marrow', '*Bone Marrow Diseases', '*Diagnosis, Differential', 'Humans', '*Leukemia', 'Leukemia, Myeloid/*diagnosis', '*Leukemia, Myelomonocytic, Acute']",['CLML: 5527:14098:80:263'],['NLM'],"['*BONE MARROW/diseases', '*LEUKEMIA, MONOCYTIC/differential diagnosis']",1954/08/01 00:00,1954/08/01 00:01,['1954/08/01 00:00'],"['1954/08/01 00:00 [pubmed]', '1954/08/01 00:01 [medline]', '1954/08/01 00:00 [entrez]']",ppublish,Krebsarzt. 1954 Aug;9(4):230-3.,,,,,,,
13202120,NLM,MEDLINE,20030501,20181201,0368-394X (Print) 0368-394X (Linking),35,3-4,1954,[Radiotherapy of a case of ulcerated hematoderma in chronic myeloid leukemia].,327-8,"['Cassou, R', 'Raymond, P', 'Villotreix, R']","['Cassou R', 'Raymond P', 'Villotreix R']",['fre'],['Journal Article'],Radiotherapie d'un cas d'hematodermies ulcerees au cours d'un leucemie myeloide chronique.,France,J Radiol Electrol Arch Electr Medicale,"Journal de radiologie, d'electrologie & archives d'electricite medicale",0013747,,OM,"['Humans', '*Leukemia', 'Leukemia, Myeloid/*complications', '*Radiotherapy', 'Ulcer/*etiology']",['CLML: 5527:13772:263:395:477'],['NLM'],"['*LEUKEMIA, MYELOCYTIC/complications', '*RADIOTHERAPY', '*ULCER/etiology and pathogenesis']",1954/01/01 00:00,1954/01/01 00:01,['1954/01/01 00:00'],"['1954/01/01 00:00 [pubmed]', '1954/01/01 00:01 [medline]', '1954/01/01 00:00 [entrez]']",ppublish,J Radiol Electrol Arch Electr Medicale. 1954;35(3-4):327-8.,,,,,,,
13201861,NLM,MEDLINE,20030501,20181201,0022-2151 (Print) 0022-2151 (Linking),68,9,1954 Sep,"Eosinophil granuloma eosinophil granuloma, Letterer-Siwe disease and Hand-Schuller-Christian disease.",575-99,"['DAWES, J D']",['DAWES JD'],['eng'],['Journal Article'],,England,J Laryngol Otol,The Journal of laryngology and otology,8706896,"['Familial Letterer-Siwe disease', 'Reticuloendotheliosis, X-linked']",OM,"['*Ear', '*Eosinophilic Granuloma', '*Eosinophils', '*Genetic Diseases, X-Linked', '*Histiocytosis, Langerhans-Cell', '*Leukemia, Hairy Cell', '*Lipidoses', '*Lymphatic Diseases', '*Radiotherapy', '*Severe Combined Immunodeficiency']",['CLML: 5527:13513:147:162:265:394:403'],['NLM'],"['*EAR', '*EOSINOPHILIC GRANULOMA', '*LIPOIDOSIS', '*RADIOTHERAPY', '*RETICULOENDOTHELIOSIS']",1954/09/01 00:00,1954/09/01 00:01,['1954/09/01 00:00'],"['1954/09/01 00:00 [pubmed]', '1954/09/01 00:01 [medline]', '1954/09/01 00:00 [entrez]']",ppublish,J Laryngol Otol. 1954 Sep;68(9):575-99.,,,,,,,
13201645,NLM,MEDLINE,20030501,20181201,0021-9738 (Print) 0021-9738 (Linking),33,10,1954 Oct,Clinical effects of the dichloro and monochlorophenyl analogues of diamino pyrimidine: antagonists of folic acid.,1388-96,"['MURPHY, M L', 'ELLISON, R R', 'KARNOFSKY, D A', 'BURCHENAL, J H']","['MURPHY ML', 'ELLISON RR', 'KARNOFSKY DA', 'BURCHENAL JH']",['eng'],['Journal Article'],,United States,J Clin Invest,The Journal of clinical investigation,7802877,"['0 (Pyrimidines)', '935E97BOY8 (Folic Acid)', 'K8CXK5Q32L (pyrimidine)']",OM,"['*Folic Acid', 'Humans', 'Leukemia/*therapy', 'Pyrimidines/*therapeutic use']",['CLML: 5527:13297:262:390'],['NLM'],"['*LEUKEMIA/therapy', '*PYRIMIDINES/therapeutic use']",1954/10/01 00:00,1954/10/01 00:01,['1954/10/01 00:00'],"['1954/10/01 00:00 [pubmed]', '1954/10/01 00:01 [medline]', '1954/10/01 00:00 [entrez]']",ppublish,J Clin Invest. 1954 Oct;33(10):1388-96. doi: 10.1172/JCI103016.,['10.1172/JCI103016 [doi]'],PMC1072559,,,,,
13200829,NLM,MEDLINE,20030501,20181201,0017-0275 (Print) 0017-0275 (Linking),35,7,1954 Jul,[Simple acute histioleukemia: Bufano's systemic histiocytic sarcomatosis].,846-71,"['BONIVENTO, M']",['BONIVENTO M'],['ita'],['Journal Article'],Istioleucemia acuta pura: sarcomatosi istiocitaria sistemica di Bufano.,Italy,G Clin Med,Giornale di clinica medica,0413411,,OM,"['Humans', '*Leukemia', 'Leukemia, Myeloid/*pathology', '*Monocytes', '*Sarcoma']",['CLML: 5527:12481:263'],['NLM'],"['*LEUKEMIA, MONOCYTIC/pathology']",1954/07/01 00:00,1954/07/01 00:01,['1954/07/01 00:00'],"['1954/07/01 00:00 [pubmed]', '1954/07/01 00:01 [medline]', '1954/07/01 00:00 [entrez]']",ppublish,G Clin Med. 1954 Jul;35(7):846-71.,,,,,,,
13199917,NLM,MEDLINE,20030501,20181201,0009-4129 (Print) 0009-4129 (Linking),10,4,1954 Apr,Letterer-Siwe's disease.,65-74,"['LOPRESTI, J', 'BERNSTEIN, J']","['LOPRESTI J', 'BERNSTEIN J']",['eng'],['Journal Article'],,United States,Clin Proc Child Hosp Dist Columbia,Clinical proceedings - Children's Hospital of the District of Columbia,7503483,"['Familial Letterer-Siwe disease', 'Reticuloendotheliosis, X-linked']",OM,"['*Genetic Diseases, X-Linked', 'Histiocytosis, Langerhans-Cell', '*Leukemia, Hairy Cell', '*Lymphatic Diseases', '*Severe Combined Immunodeficiency']",['CLML: 5527:11562:402'],['NLM'],['*RETICULOENDOTHELIOSIS'],1954/04/01 00:00,1954/04/01 00:01,['1954/04/01 00:00'],"['1954/04/01 00:00 [pubmed]', '1954/04/01 00:01 [medline]', '1954/04/01 00:00 [entrez]']",ppublish,Clin Proc Child Hosp Dist Columbia. 1954 Apr;10(4):65-74.,,,,,,,
13199794,NLM,MEDLINE,20030501,20181201,0008-5472 (Print) 0008-5472 (Linking),14,8,1954 Sep,On the etiology and pathogenesis of the leukemias: a review.,535-48,"['KAPLAN, H S']",['KAPLAN HS'],['eng'],['Journal Article'],,United States,Cancer Res,Cancer research,2984705R,,OM,"['Humans', 'Leukemia/*etiology']",['CLML: 5527:11439:262'],['NLM'],['*LEUKEMIA/etiology and pathogenesis'],1954/09/01 00:00,1954/09/01 00:01,['1954/09/01 00:00'],"['1954/09/01 00:00 [pubmed]', '1954/09/01 00:01 [medline]', '1954/09/01 00:00 [entrez]']",ppublish,Cancer Res. 1954 Sep;14(8):535-48.,,,,,,,
13199788,NLM,MEDLINE,20030501,20181201,0008-5448 (Print) 0008-5448 (Linking),6,5,1954 Sep-Oct,LEUKEMIA.,108-10,,,['eng'],['Journal Article'],,United States,Cancer Bull,"Cancer bulletin (Houston, Tex.)",0373142,,OM,"['Humans', '*Leukemia']",['CLML: 5527:11433:262'],['NLM'],['*LEUKEMIA'],1954/09/01 00:00,1954/09/01 00:01,['1954/09/01 00:00'],"['1954/09/01 00:00 [pubmed]', '1954/09/01 00:01 [medline]', '1954/09/01 00:00 [entrez]']",ppublish,Cancer Bull. 1954 Sep-Oct;6(5):108-10.,,,,,,,
13199760,NLM,MEDLINE,20030501,20190620,0008-543X (Print) 0008-543X (Linking),7,5,1954 Sep,A survey of the heights and weights of a childhood leukemic population.,849-51,"['STURGEON, P', 'DALE, M B']","['STURGEON P', 'DALE MB']",['eng'],['Journal Article'],,United States,Cancer,Cancer,0374236,,OM,"['*Body Height', '*Body Weight', 'Child', '*Data Collection', 'Humans', 'Infant', '*Leukemia']",['CLML: 5527:11405:79:80:262'],['NLM'],"['*BODY HEIGHT/in infant and child', '*BODY WEIGHT/in infant and child', '*LEUKEMIA/in infant and child']",1954/09/01 00:00,1954/09/01 00:01,['1954/09/01 00:00'],"['1954/09/01 00:00 [pubmed]', '1954/09/01 00:01 [medline]', '1954/09/01 00:00 [entrez]']",ppublish,Cancer. 1954 Sep;7(5):849-51. doi: 10.1002/1097-0142(195409)7:5<849::aid-cncr2820070503>3.0.co;2-b.,['10.1002/1097-0142(195409)7:5<849::aid-cncr2820070503>3.0.co;2-b [doi]'],,,,,,
